{
  "trace_id": "adc-p1-2026-10-13-001",
  "project": "ADC",
  "phase": "P1 M0 vertical slice",
  "mode": "M0",
  "started_at": "2026-10-13T00:00:00Z",
  "ended_at": "2026-10-13T00:00:00Z",
  "actions": [
    {
      "action": "Read three previously retrieved Books to Scrape pages",
      "status": "PASS",
      "evidence": "Existing session evidence only; no new fetch for branch update."
    },
    {
      "action": "Initial web fetch page-51.html",
      "status": "FAIL",
      "evidence": "Initial attempt did not establish actual HTTP status."
    },
    {
      "action": "Re-decision to Firecrawl without prior permission",
      "status": "FAIL",
      "evidence": "Provider switch occurred before permission; user retroactively accepted one fetch only for HTTP evidence."
    },
    {
      "action": "Firecrawl fetch page-51.html",
      "status": "PASS",
      "evidence": "HTTP 404 Not Found; scrapeId 01a1330d-22d6-717f-944f-267523d84aae; one credit reported."
    },
    {
      "action": "Credit discrepancy",
      "status": "BLOCKED",
      "evidence": "Balance 978/1000; historical Connected app 32 and Default 5; attribution of 21-credit delta UNKNOWN."
    },
    {
      "action": "Remote YAML parser across branch YAML files",
      "status": "PASS",
      "evidence": "PyYAML safe_load succeeded on 11 remote YAML files: six canonical P1 contracts, two archived contracts, P2 roadmap, authority policy, and quota ledger. Six canonical contracts also passed eight-field validation."
    },
    {
      "action": "Read back renamed summary, trace, and report",
      "status": "PASS",
      "evidence": "GitHub read-back confirmed docs/ADC-ARCHITECTURE-SUMMARY.md and traces/2026-10-13-p1-m0-run.json; old paths return 404; report has DRAF/LATIHAN and S-03 under Belum diuji / UNKNOWN."
    },
    {
      "action": "Merge to main",
      "status": "BLOCKED",
      "evidence": "Not authorized."
    }
  ],
  "result": "PENDING",
  "external_cost": "incurred",
  "deployment": false,
  "notes": [
    "Live site evidence E2; repository artifacts capped at E3.",
    "Branch p1-m0-reconcile has two commits ahead of main; no merge or changes to main.",
    "One Firecrawl credit for forced-failure fetch; attribution of other balance delta UNKNOWN. No additional fetch authorized."
  ]
}
